tweet_id	created_at	screen_name	searched_location	population	cleaned_location	user_location	place	latitude	longitude	tweet	hashtags	fav_count	retweet_count
8.464452380676465e+17	Mon Mar 27 19:34:05 +0000 2017	IOGca	baghdad,iraq	6050000.0	ottawa,canada	Ottawa	Iraq Iraq			"From April 25-26, 2017, join @IOGca and @cfnp_canada in Vancouver for a dialogue on ""Jurisdiction""! https://t.co/BN7hxu7HAJ #CNNR17"	[CNNR17]	1.0	7.0
8.472367059039764e+17	Wed Mar 29 23:59:06 +0000 2017	TrendsmapCanada	tlalnepantla de baz,mexico	685000.0	,canada	Canada	Canada Canada			Paul Rudd, @philsadelphia is now trending in Canada  https://t.co/yRoNG2BFYD https://t.co/Ye2fCyBTmi	[]	0.0	0.0
8.474358071870628e+17	Thu Mar 30 13:10:15 +0000 2017	ronnie2scronnie	gwangju,south korea	1415000.0		Seongnam-si, Republic of Korea	Republic of Korea Republic of Korea			I sincerely miss the fresh air in Canada YOU GUYS ARE LUCKY	[]	11.0	0.0
8.469173808821207e+17	Wed Mar 29 02:50:13 +0000 2017	study_ontario	gwangju,south korea	1415000.0			Changwon-si, Republic of Korea Republic of Korea			For the presentation, students should develop their own lines based on the #template No outside box allowed? #주입식교육… https://t.co/MzLo4qvzsO	[template,주입식교육]	0.0	0.0
8.469101233101169e+17	Wed Mar 29 02:21:22 +0000 2017	study_ontario	gwangju,south korea	1415000.0			Changwon-si, Republic of Korea Republic of Korea			PD day for my newphew. #초등학교 #Elementary https://t.co/gvf93Bic0j	[초등학교,Elementary]	0.0	0.0
8.465674259276677e+17	Tue Mar 28 03:39:37 +0000 2017	study_ontario	gwangju,south korea	1415000.0			Gimhae-si, Republic of Korea Republic of Korea			Arriving at Pusan, my #hometown #korea #캐나다한국학생 #온타리오컬리지 https://t.co/muobiEInkD	[hometown,korea,캐나다한국학생,온타리오컬리지]	1.0	0.0
8.47383863382782e+17	Thu Mar 30 09:43:51 +0000 2017	ICCROM	naples,italy	963000.0	rome,italy	Rome, Italy	Rome, Lazio Italy			Former ICCROM DG Mounir Bouchenaki+Patricial Kell, DG of Canadian Conservation Institute + ICCROM Council member @… https://t.co/GiEE2ztWo2	[]	10.0	5.0
8.475402091180646e+17	Thu Mar 30 20:05:07 +0000 2017	Geskalima	naples,italy	963000.0	toronto,canada	Toronto	Vatican City Vatican City			@BlackDuck481 @AmyMek Nope. They need Canada as bridge to USA.	[]	0.0	0.0
8.471892316172698e+17	Wed Mar 29 20:50:27 +0000 2017	RichardPoon_CA	huzhou,china	1800000.0	calgary,canada	Calgary	Zhejiang, People's Republic of China People's Republic of China			Really? You dumb fuck! https://t.co/2ocHTk2Vn5	[]	0.0	0.0
8.449214946060984e+17	Thu Mar 23 14:39:16 +0000 2017	estevaofragallo	sao luis,brazil	987000.0	curitiba,brazil	Curitiba, Brasil	Belém, Brazil Brazil			"""Because it was funny"", said the Canadian actor https://t.co/1DJtIo4fln"	[]	0.0	0.0
8.474411851697439e+17	Thu Mar 30 13:31:37 +0000 2017	tattsu1028	osaka,japan	2647000.0	osaka,japan	Osaka⇔Kyoto	Osaka-shi Higashiyodogawa, Osaka Japan			2017 Toronto Blue Jays JPT Calendar https://t.co/BXtNQ2bhG1	[]	1.0	1.0
8.474354577302979e+17	Thu Mar 30 13:08:52 +0000 2017	RellaC	osaka,japan	2647000.0	kyoto,japan	Nara-shi, Nara	Kyoto City Fushimi Ward, Kyoto Japan			Boards of Canada on the tokkyu. https://t.co/mfGIC3cIe0	[]	3.0	0.0
8.474569023257313e+17	Thu Mar 30 14:34:05 +0000 2017	KiltTilter	wujiang,china	970000.0	shenzhen,china	 Shenzhen, Guangdong, PR China	Guangdong, People's Republic of China People's Republic of China			Canada is better, yet again https://t.co/xXxLcs1U7c	[]	0.0	0.0
8.475979152373432e+17	Thu Mar 30 23:54:25 +0000 2017	pauldaugh	san francisco,usa	809000.0	new york,usa	New York	San Jose, CA United States			Ontario Premier @Kathleen_Wynne with our #AI Amelia virtual agent demo, we are proud to be a founding sponsor of… https://t.co/T1JVLNtvZF	[AI]	3.0	3.0
8.47474277418963e+17	Thu Mar 30 15:43:07 +0000 2017	OBEY_Beee	ciudad juarez,mexico	1400000.0	toronto,canada	Toronto, Canada	El Paso, TX United States			Need to up and leave to Toronto w/ my $oulmate ya feel me	[]	0.0	0.0
8.475924668153856e+17	Thu Mar 30 23:32:46 +0000 2017	glbastiani	melbourne,australia	3635000.0	melbourne,australia	Melbourne, Australia	Melbourne, Victoria Australia			Well, it's confirmed. My knee is stuffed &amp; needs surgery again, but has to wait a month because of Canada. Drugs are my new best friend.	[]	1.0	0.0
8.471050339802522e+17	Wed Mar 29 15:15:53 +0000 2017	RituShankar7	bhilai,india	564000.0	,india	India	India India			@TEDTalks like @JustinTrudeau 😊 so rare!!	[]	0.0	0.0
