tweet_id	created_at	screen_name	searched_location	population	cleaned_location	user_location	place	latitude	longitude	tweet	hashtags	fav_count	retweet_count
8.454792240058122e+17	Sat Mar 25 03:35:29 +0000 2017	LekenLe	dar es salaam,tanzania	2498000.0	,tanzania	Arusha Tanzania	Tanzania Tanzania			@SOSCV_Canada @MaOnTheAir @lekenle Kilimanjaro Climb What’s-App +255788455182 info@lekenadventure.com	[]	0.0	0.0
8.47230185183232e+17	Wed Mar 29 23:33:11 +0000 2017	OneRadicalDude	portland,usa	542000.0	seattle,usa	Seattle, WA, USA	Seattle, WA United States			Less than 48 hours and I'll be back in Canada for the weekend.	[]	0.0	0.0
8.473759245258834e+17	Thu Mar 30 09:12:18 +0000 2017	david_s_sh	tbilisi,georgia	1490000.0	tbilisi,georgia	Tbilisi, Georgia	Georgia Georgia	41.672407899999996	44.8603258	The Nigerian bobsleigh team racing towards history https://t.co/dHZKCD3P68 https://t.co/YsQCJgcEeA	[]	0.0	0.0
8.475038434829435e+17	Thu Mar 30 17:40:36 +0000 2017	OrfeasSi	athens,greece	757000.0	,greece	In her arms	Greece Greece			"All ""Fun Facts you didn't know about Lilly Singh"" be like: ""She comes from Toronto"" ""She wanted to become a rapper"" ""Her crush is The Rock"""	[]	3.0	1.0
8.472302406822543e+17	Wed Mar 29 23:33:24 +0000 2017	leBossLYNCH	port-au-prince,haiti	1083000.0	,jamaica	18.1315° N, 77.2736° W	Jamaica Jamaica			It's Toronto slang for being high https://t.co/ijALjOmYxp	[]	0.0	0.0
8.472052578558484e+17	Wed Mar 29 21:54:08 +0000 2017	ArielgonzalezGI	port-au-prince,haiti	1083000.0	,dominican republic	Dominican Republic	anto Domingo de Guzmán, Dominican Republic Dominican Republic			Canada wants to lead the world in artificial intelligence, and just unveiled a $127m plan to get there https://t.co/VR4FoNY8Gu	[]	0.0	0.0
8.471476875395604e+17	Wed Mar 29 18:05:22 +0000 2017	jonnajarian	port-au-prince,haiti	1083000.0	santo domingo,dominican republic	Chicago	La Altagracia, Dominican Republic Dominican Republic	18.838653	-68.60961	Careful Rick, she's a spy! RT @row31169:  better than meeting Dr J in Telluride?  Meeting Helima Croft in Canada! https://t.co/JnbbsXPHxX	[]	4.0	0.0
8.46803239743832e+17	Tue Mar 28 19:16:39 +0000 2017	Matthew_Lien	taipei,taiwan	2620000.0	taipei,taiwan	Yukon / Taiwan	Taipei City, Taiwan Taiwan			The White House seems unaware there's only one #Yukon in Canada @POTUS https://t.co/oZCcYdNRSE	[Yukon]	0.0	0.0
8.475915281597481e+17	Thu Mar 30 23:29:02 +0000 2017	cbcasithappens	florida,united states of america	0.0	florida,united	All over the world	Florida, USA United States			Via Rail botches Canada 150 youth pass promo, feels wrath of generation: https://t.co/NGC1WYN0eV https://t.co/b45lG9FbBq	[]	21.0	15.0
8.475982771471974e+17	Thu Mar 30 23:55:51 +0000 2017	angelsil_tpa	florida,united states of america	0.0	,united states	Tampa , FL	Tampa, FL United States			@SnowCanAm3 Lol. No worries. Michigan is Canada light.	[]	0.0	0.0
8.475982078447165e+17	Thu Mar 30 23:55:35 +0000 2017	BethanyJo1986	florida,united states of america	0.0	ohio,usa	Ohio	Florida, USA United States			@Sandy_Dover Nope. To a certain someone that is literally moving across the US up to the pacific side of Canada.	[]	0.0	0.0
8.475942000361923e+17	Thu Mar 30 23:39:39 +0000 2017	markrsmithcpa	florida,united states of america	0.0	,united states	Venice, FL	Tampa, FL United States			Let's go @TBLightning  vs @DetroitRedWings  enjoying a @Molson_Canadian https://t.co/bGmsALJxaH	[]	1.0	0.0
8.475504717998039e+17	Thu Mar 30 20:45:53 +0000 2017	patrickimoh	douala,cameroon	1382000.0	,nigeria	Nigeria	Eket, Nigeria Nigeria			Nigeria burleigh women team currently training in Canada are cutting their living expenses in order to qualify for the winter Olympics.	[]	0.0	0.0
8.475787859604767e+17	Thu Mar 30 22:38:24 +0000 2017	RCRYSTHINEYAHO1	belo horizonte,brazil	2453000.0	,brazil		Vitória, Brazil Brazil			@uolempregocerto HELLO! HI HOW ARE YOU, I AM A DESIGN  ARTIST.I WANT TO GO TO WORK IN ANOTHER… https://t.co/KlmexQTPJb	[]	0.0	0.0
8.475464033374904e+17	Thu Mar 30 20:29:43 +0000 2017	godblessamaryca	montevideo,uruguay	1326000.0	buenos aires,argentina	Fayetteville, TX	Ciudad Autónoma de Buenos Aires, Argentina Argentina			61. Seaweed by Mount Eerie If it ever comes up, i don't like canada geese but i love fox gloves	[]	1.0	0.0
8.472663719100252e+17	Thu Mar 30 01:56:59 +0000 2017	PanAmHockey	montevideo,uruguay	1326000.0	buenos aires,argentina		Buenos Aires City Region, Argentina Argentina			Check day 3 results at #HWL2017 in Tacarigua on this article! --&gt; https://t.co/Yzq9blL3kC @FIH_Hockey https://t.co/ZBH6ir9RWR	[HWL2017]	7.0	4.0
8.470940925301432e+17	Wed Mar 29 14:32:24 +0000 2017	kristaarnold5	mandalay,burma	0.0	mandalay,burma	Aurora, ON	Myanmar Myanmar	22.6167	97.3	Just another day of trekking 💪🗻🌞 🐄🚷 #travel #asia #backpacker #canadian #traveller #solotravel… https://t.co/Fq8qKEj00R	[travel,asia,backpacker,canadian,traveller,solotravel]	0.0	0.0
8.470544072084562e+17	Wed Mar 29 11:54:42 +0000 2017	Chrisalejomonro	quito,ecuador	1648000.0	quito,ecuador		Quito, Ecuador Ecuador			A340 #Iberia #Interjet #Air Canada Rouge @TorreElDorado @n_larenas @Iberia @AirCanada @interjet https://t.co/El3ECeyIPY	[Iberia,Interjet,Air]	8.0	2.0
8.475984717753098e+17	Thu Mar 30 23:56:37 +0000 2017	stnifr	milwaukee,usa	604000.0	,united states	₩ISCΦИSIИ	Oshkosh, WI United States			End seal clubbing and I will move to Canada @JustinTrudeau	[]	0.0	0.0
8.443963973361705e+17	Wed Mar 22 03:52:43 +0000 2017	Writtenbykatuka	fuxin,china	690000.0	,china	Liaoning, People's Republic of	Liaoning, People's Republic of China People's Republic of China			I think @torylanez is the best artist of this generation 🙋🏾‍♂️ paints a picture perfectly well with the music. Chixtap4 &amp; New Toronto 🔥🔥🔥🔥	[]	8.0	1.0
8.469944418104279e+17	Wed Mar 29 07:56:25 +0000 2017	arifansari14	bhopal,india	1458000.0	,india	baroda	Vododara, India India			Its indian actor(@iamsrk) vs canadian actor (@akshaykumar ) this independence.....	[]	0.0	0.0
8.474859026789294e+17	Thu Mar 30 16:29:19 +0000 2017	SujataBerry	aleppo,syria	2360000.0	toronto,canada	Toronto	Syria Syria			@DebSeligsohn Canadian Broadcasting Radio would like to interview you. Pls email sujata.berry(at)cbc.ca with best phone # to reach you. tks	[]	0.0	0.0
8.474585882556006e+17	Thu Mar 30 14:40:47 +0000 2017	DISupdates	jacksonville,usa	808000.0	,united states	Daytona Beach, FL	Daytona Beach, FL United States			Different sets of wheels are taking to the track at @DISupdates today! The Canadian National Wheelchair Racing Team… https://t.co/XQP6INIS7A	[]	38.0	11.0
8.474696503257211e+17	Thu Mar 30 15:24:44 +0000 2017	DISupdates	jacksonville,usa	808000.0	,united states	Daytona Beach, FL	Daytona Beach, FL United States			It was a pleasure to have the Canadian National Wheelchair Racing Team at the track today! 🇨🇦 https://t.co/PAFliXSeNw	[]	49.0	8.0
8.472282702737408e+17	Wed Mar 29 23:25:35 +0000 2017	Danni_657	phoenix,usa	1568000.0	,united states		Tempe, AZ United States			Honest to goodness my life's dream is to live in Canada or New Zeland.	[]	0.0	0.0
8.470961754339533e+17	Wed Mar 29 14:40:41 +0000 2017	SkateCanada	helsinki,finland	583000.0	helsinki,finland	Canada	Helsinki, Finland Finland	60.20565264	24.92919438	🥈🥉🇨🇦Fantastic performances from the Canadian women! Osmond is in 2nd and Daleman sits in 3rd… https://t.co/4z1sckdSrC	[]	118.0	36.0
8.474180861436641e+17	Thu Mar 30 11:59:50 +0000 2017	CanadaEstonia	helsinki,finland	583000.0		Tallinn, Estonia	Tallinn, Estonia Estonia			Welcome to tonight’s #TMW2017 #MadeInCanada event to celebrate #Canadian music! 🇨🇦🎵 Tickets available… https://t.co/fe9ekgvn1s	[TMW2017,MadeInCanada,Canadian]	10.0	6.0
8.464804985243443e+17	Mon Mar 27 21:54:12 +0000 2017	tha_rami	cologne,germany	995000.0	,netherlands	30,000ft	Hilversum, Nederland The Netherlands			I like how one of Logan's core messages is that if you cross from the US into Canada, suddenly literally everything is fine.	[]	534.0	124.0
8.446402552989327e+17	Wed Mar 22 20:01:44 +0000 2017	falkirkbairns	scotland,uk	0.0	scotland,uk	Falkirk	Edinburgh, Scotland United Kingdom			INTERNATIONAL BAIRN: @FraserAird has given Canada the lead over Scotland at Easter Road. #COYB	[COYB]	98.0	30.0
8.475716822021366e+17	Thu Mar 30 22:10:10 +0000 2017	blobrana	scotland,uk	0.0	scotland,uk	( Location: Pictland )	Aberdeen, Scotland United Kingdom			The Revelstoke (CI1) #meteorite fell in British Columbia, Canada, on the 31st March, 1965. https://t.co/xh65QPV8eZ	[meteorite]	0.0	0.0
8.475716475863695e+17	Thu Mar 30 22:10:02 +0000 2017	blobrana	scotland,uk	0.0	scotland,uk	( Location: Pictland )	Aberdeen, Scotland United Kingdom			The Peace River (L6) #meteorite fell in Alberta, Canada, on the 31st March, 1963. https://t.co/7s1AIFgJhX	[meteorite]	0.0	1.0
8.475705933231268e+17	Thu Mar 30 22:05:51 +0000 2017	blobrana	scotland,uk	0.0	scotland,uk	( Location: Pictland )	Aberdeen, Scotland United Kingdom			Otto Julius Klotz OLS, DLS, DTS (March 31, 1852 - December 28, 1923) was a Canadian astronomer https://t.co/XAKl38RTxD #anniversary	[anniversary]	0.0	0.0
8.456903720303698e+17	Sat Mar 25 17:34:31 +0000 2017	KRozenberg	conakry,guinea	1931000.0	,sierra leone	Saint Andrews, New Brunswick	Sierra Leone Sierra Leone			#HMCSSummerside .@CanadainSL paid tribute to Canadian, allied service personnel at the #Commonwealth Cemetery in Fr… https://t.co/rHZA2DmtX8	[HMCSSummerside,Commonwealth]	10.0	12.0
8.455572680830976e+17	Sat Mar 25 08:45:37 +0000 2017	KRozenberg	conakry,guinea	1931000.0	,sierra leone	Saint Andrews, New Brunswick	Sierra Leone Sierra Leone			#canada150 #HMCSMoncton Proud Ambasadors for #Canada in West Africa #NeptuneTrident https://t.co/oVCR9zjvLl	[canada150,HMCSMoncton,Canada,NeptuneTrident]	3.0	2.0
8.47510728294699e+17	Thu Mar 30 18:07:58 +0000 2017	marekcyprian	lodz,poland	783000.0	warsaw,poland	Dębica	Warsaw, Poland Poland	52.22185	21.04215	HRAP team charity match vs. Canada #hrap #hokejowareprezentacjaartystowpolskich #hokejzgwiazdami… https://t.co/11jrdTsIQX	[hrap,hokejowareprezentacjaartystowpolskich,hokejzgwiazdami]	0.0	0.0
8.474931734422036e+17	Thu Mar 30 16:58:12 +0000 2017	marcingabrys	lodz,poland	783000.0	krakow,poland	Kraków	Krakow, Poland Poland			Canada 150 is a celebration of Indigenous genocide https://t.co/AmNsZChtlo #canada150	[canada150]	0.0	0.0
8.47486401482326e+17	Thu Mar 30 16:31:18 +0000 2017	tomeksoroka	lodz,poland	783000.0	krakow,poland	Kraków, Polska	Krakow, Poland Poland			#Trump takes first step in #NAFTA renegotiation: Sends draft letter to Congress - TheChronicleHerald.ca https://t.co/m4z4mJ90yZ	[Trump,NAFTA]	0.0	0.0
8.473863290337894e+17	Thu Mar 30 09:53:39 +0000 2017	tomeksoroka	lodz,poland	783000.0	krakow,poland	Kraków, Polska	Krakow, Poland Poland			#Canada -U.S. #softwood lumber deal could be quick—or arduous https://t.co/NIGSJFJybE	[Canada,softwood]	0.0	0.0
8.453087089513964e+17	Fri Mar 24 16:17:55 +0000 2017	Invent_Animate	new orleans,usa	0.0	texas,usa	Texas, USA	Ferry Pass, FL United States			boom. see you this summer in canada with @Northlane and @Intervalsmusic. https://t.co/ciYoLXJHXZ	[]	117.0	29.0
8.473373773956874e+17	Thu Mar 30 06:39:08 +0000 2017	carrentalapp	ankara,turkey	3764000.0	,turkey	Bengaluru, India	Turkey Turkey			#Rental #companies in United States and Canada, are going fr complete fleet management automation https://t.co/TDpoWVeCVE #Turkey #nofollow	[Rental,companies,Turkey,nofollow]	5.0	6.0
8.468088229749637e+17	Tue Mar 28 19:38:51 +0000 2017	kerim_miray	ankara,turkey	3764000.0	moscow,russia	Province of Moscow, Russia	Bartın, Türkiye Turkey			@JustinTrudeau @ParksCanada bravo dear prisedent	[]	1.0	0.0
8.464899503968256e+17	Mon Mar 27 22:31:45 +0000 2017	rayramos_2	natal,brazil	790000.0	fortaleza,brazil		Fortaleza, Brazil Brazil	-3.75394103	-38.5259865	I'm at Portal do Canada I https://t.co/V1auRlgk1N	[]	0.0	0.0
8.449421927372104e+17	Thu Mar 23 16:01:31 +0000 2017	mewren	cochabamba,bolivia	608000.0	toronto,canada	Toronto	Arica, Chile Chile			Canada must ban neonics: help TODAY by sending a form letter to Canada’s minister of health &amp; PMRA… https://t.co/OQu75Js3Jw	[]	1.0	0.0
8.450057053545964e+17	Thu Mar 23 20:13:54 +0000 2017	AndrewLawton	detroit,usa	912000.0	london,uk	London, Canada	London, Ontario Canada			Canada's Parliament has just declared criticism of Islam off-limits. The anti-Islamophobia motion, M-103, passed by a margin of 201 to 91.	[]	1987.0	2275.0
8.472364894150164e+17	Wed Mar 29 23:58:14 +0000 2017	KiraC91	detroit,usa	912000.0	detroit,usa	Windsor, Ontario	Windsor, Ontario Canada	42.3227	-83.01053	Doesn't get any more Canadian than this &lt;3 #canadiantea… https://t.co/rseNpk7ZEY	[canadiantea]	0.0	0.0
8.472355177163776e+17	Wed Mar 29 23:54:22 +0000 2017	BlurNorthAm	new york,usa	0.0	montreal,canada	#Montreal #NYC	Bronx, NY United States			"""Aight, Canada, I heard ya.""  -@Damonalbarn @gorillaz ➡️ https://t.co/EkiXQsFBYS 😱😱🇨🇦 https://t.co/TVybbLRcPR"	[]	26.0	1.0
8.472687489689436e+17	Thu Mar 30 02:06:25 +0000 2017	Rafytek	culiacan,mexico	567000.0	,mexico		Durango, México Mexico			Ford to announce Ontario engine program in a boost to Canada automaking https://t.co/Fu89geiB7y	[]	0.0	0.0
8.469464941754245e+17	Wed Mar 29 04:45:54 +0000 2017	nibarguen	culiacan,mexico	567000.0	california,us	ÜT: 25.799635,-80.285605	Los Cabos, Baja California Sur Mexico			HSUS: Nicolas, the Canadian seal hunt started early this year--and nursing mother seals can now be killed. Help now: https://t.co/44qnTntSLs	[]	0.0	0.0
8.475332632583086e+17	Thu Mar 30 19:37:31 +0000 2017	simongconway	bursa,turkey	1400000.0	glasgow,uk	Glasgow, Scotland	İstanbul, Türkiye Turkey			"""antagonising both groups, 140 characters at a time, seems an uncertain way of realising that goal"" https://t.co/voNX0mv0s2"	[]	0.0	0.0
8.472336466794127e+17	Wed Mar 29 23:46:56 +0000 2017	mac_mccaskill	glasgow,uk	581000.0	scotland,uk	Scotland	Dalgety Bay, Scotland United Kingdom			STOP PRESS - Mexicans not keen to fund US border wall. Republicans baffled. https://t.co/oK4OSEThNv	[]	0.0	0.0
8.475229130329129e+17	Thu Mar 30 18:56:23 +0000 2017	SherylFroese	perth,australia	1603000.0	perth,australia		Perth, Western Australia Australia			Wow ....that was hard to watch .....but well done guys...Canada comes away with the win, and winners are grinners😁😁😁😉😉😉😃👍🏻	[]	0.0	0.0
8.475206455501783e+17	Thu Mar 30 18:47:22 +0000 2017	SherylFroese	perth,australia	1603000.0	perth,australia		Perth, Western Australia Australia			PC for Canada......yes!!!!!!goal 2-1 Canada woohoo!!!!!!	[]	0.0	0.0
8.475153956195656e+17	Thu Mar 30 18:26:31 +0000 2017	SherylFroese	perth,australia	1603000.0	perth,australia		Perth, Western Australia Australia			@FieldHockeyCan yes!!!!!goal!!!!!lets go Canada...lets go!!!!!	[]	1.0	0.0
8.475977189858836e+17	Thu Mar 30 23:53:38 +0000 2017	Mousey484	boston,usa	621000.0	,united states	MA	North Attleboro, MA United States			Reasons to move to #Canada low RX prices, #LGBTrights🏳️‍🌈, 🇨🇦universal healthcare, @SchittsCreek 😘 and @danjlevy	[Canada,LGBTrights]	2.0	0.0
8.475942437870182e+17	Thu Mar 30 23:39:49 +0000 2017	BIGJOEONTHEGO	nashville,usa	626000.0	nashville,usa	Kaneohe, HI	Nashville, TN United States			Getting ready for Live From Smashville on @WSMV as @PredsNHL get ready for Toronto.  Please gather the kids and have family time.	[]	3.0	0.0
8.474930961955062e+17	Thu Mar 30 16:57:54 +0000 2017	dinaliz2	beirut,lebanon	1250000.0	,lebanon	lebanon	Lebanon Lebanon			The fun part about having ur friend do a rotation in Canada is tht u crack a joke at this time he has to suppress the laugh cz he's in a lec	[]	0.0	0.0
8.475735386766295e+17	Thu Mar 30 22:17:33 +0000 2017	MadeleineFogde	copenhagen,denmark	1096000.0	stockholm,sweden	Stora Hult & Stockholm	Ängelholm, Sverige Sweden			BBC News - Trump Russia dossier key claim 'verified' https://t.co/3kjqYbbrmQ	[]	0.0	0.0
8.47466372569342e+17	Thu Mar 30 15:11:43 +0000 2017	AlexGoldApel	copenhagen,denmark	1096000.0	montreal,canada	Montreal, Quebec, Canada	Copenhagen, Denmark Denmark			The Canadian Human Rights Commission has issued 3 compliance orders that the government has ignored @cblackst https://t.co/wlChXmNhKq	[]	0.0	0.0
8.475988839119913e+17	Thu Mar 30 23:58:16 +0000 2017	lexuspilot	houston,usa	2242000.0	san antonio,usa	Red state hell	San Antonio, TX United States			@LadyLexusRX I saw this on the BBC thought you should see it:  The Nigerian bobsleigh team racing towards history - https://t.co/MGBhVIdu44	[]	2.0	1.0
8.475985233569915e+17	Thu Mar 30 23:56:50 +0000 2017	lexuspilot	houston,usa	2242000.0	san antonio,usa	Red state hell	San Antonio, TX United States			"@LadyLexusRX   ""Like rolling down a hill in a trash can"": Meet the Nigerian bobsleigh team - https://t.co/AcPOt2UJSX"	[]	1.0	0.0
8.475030660855726e+17	Thu Mar 30 17:37:31 +0000 2017	Hostelman	odessa,ukraine	1080000.0	berlin,germany	Berlin and Kiev	Ukraine Ukraine			Northwest Passage Eastbound  https://t.co/QvgZ1eCFkq  #Arctic #Canada #Greenland #Cruise #Landscapes #Glacier… https://t.co/A84IjelMUc	[Arctic,Canada,Greenland,Cruise,Landscapes,Glacier]	0.0	0.0
8.469775647196979e+17	Wed Mar 29 06:49:22 +0000 2017	Wizdomination_	odessa,ukraine	1080000.0	,ukraine	Ukraine	Ukraine Ukraine			It's more internationally recognized than Mbchb .. You study MBBS in the US, Canada, And other European countries https://t.co/ZsXGVnngju	[]	0.0	0.0
8.469773108300268e+17	Wed Mar 29 06:48:21 +0000 2017	Wizdomination_	odessa,ukraine	1080000.0	,ukraine	Ukraine	Ukraine Ukraine			I've done the research .. my uncle had a doctor friend who had to study 3 years before being allowed to go work in… https://t.co/Xr0DqYYHpK	[]	0.0	0.0
8.469662084486472e+17	Wed Mar 29 06:04:14 +0000 2017	Wizdomination_	odessa,ukraine	1080000.0	,ukraine	Ukraine	Ukraine Ukraine			It's not for residency, it's for the medical exam that will slow you to practice as a doctor in Canada ..you automa… https://t.co/pv5WSKr88i	[]	0.0	0.0
8.469613677436969e+17	Wed Mar 29 05:45:00 +0000 2017	Wizdomination_	odessa,ukraine	1080000.0	,ukraine	Ukraine	Ukraine Ukraine			Nope. if u want to go &amp; work in Canada for example, you'll need to study 3 years to qualify to do the exam that wil… https://t.co/RjxA0WIr7D	[]	0.0	0.0
8.46848539590316e+17	Tue Mar 28 22:16:40 +0000 2017	Wizdomination_	odessa,ukraine	1080000.0	,ukraine	Ukraine	Ukraine Ukraine			It's higher caliber coz its more recognized internationally. You get the same degree from the US, Canada,China and… https://t.co/lplXKpJWNj	[]	0.0	2.0
8.466384498222408e+17	Tue Mar 28 08:21:50 +0000 2017	JYushko	odessa,ukraine	1080000.0	,ukraine	Ukraine	Ukraine Ukraine			At that moment I wish to have relatives in Canada. Don't ask me why :-) S.M. (pretending there Canadian flag) haha	[]	0.0	0.0
8.466211352990761e+17	Tue Mar 28 07:13:02 +0000 2017	mhmck	odessa,ukraine	1080000.0	ottawa,canada	Ottawa	Ukraine Ukraine			Canada to Ukraine: medical kits, training materials for military police, and equipment for disposal of ammunition. https://t.co/LPngANeZeZ	[]	3.0	8.0
8.47208371983913e+17	Wed Mar 29 22:06:30 +0000 2017	AtheistMohamed	giza,egypt	2225000.0	cairo,egypt		Cairo, Egypt Egypt			"The fuck is going on with Montreal, exactly?!   I admit I chuckled reading ""Trudeau International Airport"" though. https://t.co/kBG4kZLiMw"	[]	6.0	3.0
8.471965654292685e+17	Wed Mar 29 21:19:36 +0000 2017	AtheistMohamed	giza,egypt	2225000.0	cairo,egypt		Cairo, Egypt Egypt			"Anyway, nice to see Mr. Trudeau's war on ""Islamophobia"" and criticizing Islam going well. It's clearly what's neede… https://t.co/v8zmyKuBLC"	[]	14.0	5.0
8.475093926060237e+17	Thu Mar 30 18:02:39 +0000 2017	MarFreckles	barcelona,spain	1673000.0	barcelona,spain	Barcelona	Barcelona, Spain Spain			#Google in Canada with #AI Google Brain Toronto https://t.co/og3yemOyq8	[Google,AI]	0.0	0.0
8.475035928481137e+17	Thu Mar 30 17:39:37 +0000 2017	cabinets4cheap	barcelona,spain	1673000.0	,united states	South Carolina, USA	United States United States			We wants to make your #kitchen and #bath #cabinetry project easier by providing free #kitchendesigns.… https://t.co/1qT8IZNaUz	[kitchen,bath,cabinetry,kitchendesigns]	1.0	0.0
8.474323692754043e+17	Thu Mar 30 12:56:36 +0000 2017	emmawilliam936	barcelona,spain	1673000.0	,united states		United States United States			How Does Gmail Technical Support Team Help To Create Password For Gmail App? https://t.co/KD2bF1PLdZ #TechSupportforGmail	[TechSupportforGmail]	0.0	0.0
8.474911892049347e+17	Thu Mar 30 16:50:19 +0000 2017	Mrityunjoykjha	gwalior,india	690000.0	,india	Gurgaon,Noida, India	Gurgaon, India India			"Why ""privately"" ?? Had this bn in the US or Canada , it wd hv bn in public I am sure https://t.co/9LWBZzbBR1"	[]	1.0	0.0
8.47232567942103e+17	Wed Mar 29 23:42:39 +0000 2017	AdamWClayton	atlanta,usa	538000.0	,united states	Lawrenceburg,TN	Huntsville, AL United States			Spent over 1/3 of this game on the penalty kill. Still whipped team Canada. https://t.co/6Jt21UDaQQ	[]	1.0	0.0
8.475777652641915e+17	Thu Mar 30 22:34:21 +0000 2017	CS2Nigeria	ogbomosho,nigeria	726000.0	abuja,nigeria	Abuja, Nigeria	Abuja, Nigeria Nigeria			"BBC News - ""Like rolling down a hill in a trash can"": Meet the Nigerian bobsleigh team https://t.co/T3WsxZVuzj"	[]	0.0	0.0
8.442023179981824e+17	Tue Mar 21 15:01:31 +0000 2017	JohnTory	mumbai,india	13900000.0	toronto,canada	Toronto	Mumbai, India India			The Toronto sign will be lit in blue &amp; yellow today to mark #WorldDownSyndromeDay. Lend your support at:… https://t.co/6pEdEBsQPJ	[WorldDownSyndromeDay]	419.0	189.0
8.445954481407795e+17	Wed Mar 22 17:03:41 +0000 2017	JohnTory	mumbai,india	13900000.0	toronto,canada	Toronto	Mumbai, India India			Saddened by news of an attack outside UK Parliament. My thoughts are with those affected by this terror. Toronto stands united with London.	[]	280.0	105.0
8.470441947241677e+17	Wed Mar 29 11:14:07 +0000 2017	emojischwein	prague,czech republic	1242000.0	prague,czech republic	Baden-Württemberg, Deutschland	Dresden, Germany Germany	51.05196149	13.74120557	I'm at Ontario in Dresden, Sachsen https://t.co/sDR0Fhx4PU https://t.co/a9Rl5oGVpZ	[]	6.0	0.0
8.473631854557757e+17	Thu Mar 30 08:21:41 +0000 2017	Miaozzz	shijiazhuang,china	2630000.0	beijing,china		Beijing, People's Republic of China People's Republic of China	39.90538735	116.22116878	😘 sexy #90s #japangirl #happy #外围 #外围女 #纽约 #金门大桥 #华尔街 #洛杉矶 #黄石公园 #canada #华盛顿 #拉斯维加斯 #澳门 #香港… https://t.co/mNAbOamhH7	[90s,japangirl,happy,外围,外围女,纽约,金门大桥,华尔街,洛杉矶,黄石公园,canada,华盛顿,拉斯维加斯,澳门,香港]	0.0	0.0
8.470552048099369e+17	Wed Mar 29 11:57:53 +0000 2017	annemariealfDPT	shijiazhuang,china	2630000.0	beijing,china	Carlsbad, CA	Beijing, People's Republic of China People's Republic of China	39.93595376	116.39306325	When in China... make new friends (who are Canadian Physios) ; travel thru random hutongs ; and… https://t.co/hQQDqLgJAQ	[]	0.0	0.0
8.465633680686367e+17	Tue Mar 28 03:23:29 +0000 2017	SandraOllyver	recife,brazil	1561000.0	maceio,brazil	Canhotinho, Pernambuco	Canhotinho, Brasil Brazil	-8.88147079	-36.19518555	I'm at Canada https://t.co/HSBqQ8UYYy	[]	0.0	0.0
8.458473498848338e+17	Sun Mar 26 03:58:17 +0000 2017	acarolsf_	recife,brazil	1561000.0	,brazil	snap: badgalcaca	Caicó, Brasil Brazil			Someone in Canada, give me a job. I need to work	[]	1.0	0.0
8.458471808166011e+17	Sun Mar 26 03:57:37 +0000 2017	acarolsf_	recife,brazil	1561000.0	,brazil	snap: badgalcaca	Caicó, Brasil Brazil			I wanna a job in Canada, anything?	[]	0.0	0.0
8.471383440562954e+17	Wed Mar 29 17:28:14 +0000 2017	mpgeve1	caracas,venezuela	2762000.0		Actualmente vivo en Curazao	Curaçao Curaçao			We, venezuelan citizens (an overwhelming majority of whom are democracy minded) feel absolutely grateful for Canada… https://t.co/iXHeXvJ2se	[]	0.0	0.0
8.475124295461929e+17	Thu Mar 30 18:14:43 +0000 2017	atetoomuchchoco	daegu,south korea	2512000.0		대한민국 서울	Gwangjin-gu, Republic of Korea Republic of Korea			Well done! Amazing human beings out there 🐻🌿  US hiker given warning for rescuing 'abandoned' bear cub - https://t.co/VQqnN9Mt2K	[]	0.0	0.0
8.474576083236782e+17	Thu Mar 30 14:36:53 +0000 2017	RobertoUebel	porto alegre,brazil	1355000.0	,brazil	Novo Hamburgo, Brasil	Novo Hamburgo, Brasil Brazil			@CanadaBrazil @savoner I would like to contact the education office of the Embassy about research aid on Brazil/Canada. Is there any email?	[]	0.0	0.0
8.472174753601004e+17	Wed Mar 29 22:42:41 +0000 2017	estudo_trabalho	porto alegre,brazil	1355000.0	porto alegre,brazil	Christchurch City, New Zealand	Novo Hamburgo, Brasil Brazil	-29.6833	-51.1333	Canada 🇨🇦 it is always present in my Language exchange and trips stand. That awesome!… https://t.co/huGByw503C	[]	0.0	0.0
8.445387100581601e+17	Wed Mar 22 13:18:13 +0000 2017	Carmgoestoshows	haicheng,china	1130000.0	fushun,china	Dunnville	Liaoning, People's Republic of China People's Republic of China	41.7922	123.433	#travel #china #shenyang #hockeynightinchina #hockey #sports #canadian #iamcanadian #2017 a fun… https://t.co/sd3s1EJLb6	[travel,china,shenyang,hockeynightinchina,hockey,sports,canadian,iamcanadian]	1.0	0.0
8.470532106322493e+17	Wed Mar 29 11:49:57 +0000 2017	danibrrlr	oran,algeria	683000.0	london,uk	London / Madrid	Almería, Spain Spain			Before signing any FTA the UK will lose its preferential trade status with the biggest market in the world as well as S Korea, Canada...	[]	1.0	0.0
8.450013983161385e+17	Thu Mar 23 19:56:47 +0000 2017	MolloyAnthony	oran,algeria	683000.0	,spain	Spain	Almería, Spain Spain			456 When did Canada declare war on Germany https://t.co/lTy3OFZfXO Thrilling SPECIAL FORCES stories that make up the longest WW2 epic ever	[]	0.0	0.0
